{
  "profileId": "client",
  "version": "1.0.0",
  "coverageFloor": 0.8,
  "edges": [
    { "edgeId": "lead_created_to_first_engagement", "journeyId": "client_sales", "journeyInstanceId": "journey_client_sales", "fromStage": "lead_created", "toStage": "first_engagement", "eligibilityRule": {}, "fromEventFields": [], "toEventFields": [], "allowedLag": { "amount": 2, "unit": "days" }, "maturityRule": {}, "dispositions": ["engaged", "unresponsive", "unknown"], "reentryRule": "new_journey_instance", "outcomeRule": {}, "required": true, "nativeMapping": "MAPPED" },
    { "edgeId": "first_engagement_to_qualified", "journeyId": "client_sales", "journeyInstanceId": "journey_client_sales", "fromStage": "first_engagement", "toStage": "qualified", "eligibilityRule": {}, "fromEventFields": [], "toEventFields": [], "allowedLag": { "amount": 14, "unit": "days" }, "maturityRule": {}, "dispositions": ["qualified", "disqualified", "unknown"], "reentryRule": "new_journey_instance", "outcomeRule": {}, "required": true, "nativeMapping": "UNKNOWN" },
    { "edgeId": "qualified_to_booked", "journeyId": "client_sales", "journeyInstanceId": "journey_client_sales", "fromStage": "qualified", "toStage": "booked", "eligibilityRule": {}, "fromEventFields": [], "toEventFields": [], "allowedLag": { "amount": 30, "unit": "days" }, "maturityRule": {}, "dispositions": ["booked", "not_booked", "unknown"], "reentryRule": "new_journey_instance", "outcomeRule": {}, "required": true, "nativeMapping": "UNKNOWN" },
    { "edgeId": "booked_to_showed", "journeyId": "client_sales", "journeyInstanceId": "journey_client_sales", "fromStage": "booked", "toStage": "showed", "eligibilityRule": {}, "fromEventFields": [], "toEventFields": [], "allowedLag": { "amount": 14, "unit": "days" }, "maturityRule": {}, "dispositions": ["showed", "no_show", "cancelled", "unknown"], "reentryRule": "new_journey_instance", "outcomeRule": {}, "required": true, "nativeMapping": "MAPPED" },
    { "edgeId": "booked_to_no_show", "journeyId": "client_sales", "journeyInstanceId": "journey_client_sales", "fromStage": "booked", "toStage": "no_show", "eligibilityRule": {}, "fromEventFields": [], "toEventFields": [], "allowedLag": { "amount": 14, "unit": "days" }, "maturityRule": {}, "dispositions": ["no_show", "showed", "cancelled", "unknown"], "reentryRule": "new_journey_instance", "outcomeRule": {}, "required": true, "nativeMapping": "MAPPED" },
    { "edgeId": "booked_to_cancelled", "journeyId": "client_sales", "journeyInstanceId": "journey_client_sales", "fromStage": "booked", "toStage": "cancelled", "eligibilityRule": {}, "fromEventFields": [], "toEventFields": [], "allowedLag": { "amount": 14, "unit": "days" }, "maturityRule": {}, "dispositions": ["cancelled", "showed", "no_show", "unknown"], "reentryRule": "new_journey_instance", "outcomeRule": {}, "required": true, "nativeMapping": "MAPPED" },
    { "edgeId": "cancelled_to_rebooked", "journeyId": "client_sales", "journeyInstanceId": "journey_client_sales", "fromStage": "cancelled", "toStage": "rebooked", "eligibilityRule": {}, "fromEventFields": [], "toEventFields": [], "allowedLag": { "amount": 30, "unit": "days" }, "maturityRule": {}, "dispositions": ["rebooked", "not_rebooked", "unknown"], "reentryRule": "new_journey_instance", "outcomeRule": {}, "required": true, "nativeMapping": "UNKNOWN" },
    { "edgeId": "showed_to_opportunity_outcome_30d", "journeyId": "client_sales", "journeyInstanceId": "journey_client_sales", "fromStage": "showed", "toStage": "opportunity_outcome", "eligibilityRule": {}, "fromEventFields": [], "toEventFields": [], "allowedLag": { "amount": 30, "unit": "days" }, "maturityRule": {}, "dispositions": ["won", "lost", "open", "unknown"], "reentryRule": "same_journey_instance", "outcomeRule": {}, "required": true, "nativeMapping": "MAPPED", "reportingWindows": ["trailing60Days"] },
    { "edgeId": "showed_to_opportunity_outcome_60d", "journeyId": "client_sales", "journeyInstanceId": "journey_client_sales", "fromStage": "showed", "toStage": "opportunity_outcome", "eligibilityRule": {}, "fromEventFields": [], "toEventFields": [], "allowedLag": { "amount": 60, "unit": "days" }, "maturityRule": {}, "dispositions": ["won", "lost", "open", "unknown"], "reentryRule": "same_journey_instance", "outcomeRule": {}, "required": true, "nativeMapping": "MAPPED", "reportingWindows": ["trailing90Days"] },
    { "edgeId": "showed_to_opportunity_outcome", "journeyId": "client_sales", "journeyInstanceId": "journey_client_sales", "fromStage": "showed", "toStage": "opportunity_outcome", "eligibilityRule": {}, "fromEventFields": [], "toEventFields": [], "allowedLag": { "amount": 90, "unit": "days" }, "maturityRule": {}, "dispositions": ["won", "lost", "open", "unknown"], "reentryRule": "same_journey_instance", "outcomeRule": {}, "required": true, "nativeMapping": "MAPPED", "reportingWindows": ["trailing180Days"] },
    { "edgeId": "won_to_collected_revenue", "journeyId": "client_sales", "journeyInstanceId": "journey_client_sales", "fromStage": "won", "toStage": "collected_revenue", "eligibilityRule": {}, "fromEventFields": [], "toEventFields": [], "allowedLag": { "amount": 60, "unit": "days" }, "maturityRule": {}, "dispositions": ["collected", "uncollected", "unknown"], "reentryRule": "new_journey_instance", "outcomeRule": {}, "required": true, "nativeMapping": "MAPPED", "measure": "VALUE" },
    { "edgeId": "closed_to_reactivated", "journeyId": "client_sales", "journeyInstanceId": "journey_client_sales", "fromStage": "closed", "toStage": "reactivated", "eligibilityRule": {}, "fromEventFields": [], "toEventFields": [], "allowedLag": { "amount": 180, "unit": "days" }, "maturityRule": {}, "dispositions": ["reactivated", "not_reactivated", "unknown"], "reentryRule": "new_journey_instance", "outcomeRule": {}, "required": false, "nativeMapping": "UNKNOWN" }
  ]
}
