{
  "profileId": "grom_internal",
  "version": "1.0.0",
  "coverageFloor": 0.8,
  "edges": [
    { "edgeId": "enquiry_to_contacted", "journeyId": "agency_new_business", "journeyInstanceId": "journey_agency_new_business", "fromStage": "enquiry", "toStage": "contacted", "eligibilityRule": {}, "fromEventFields": [], "toEventFields": [], "allowedLag": {"amount": 2, "unit": "days"}, "maturityRule": {}, "dispositions": ["contacted", "unresponsive", "unknown"], "reentryRule": "new_journey_instance", "outcomeRule": {}, "required": true, "nativeMapping": "MAPPED" },
    { "edgeId": "contacted_to_qualified", "journeyId": "agency_new_business", "journeyInstanceId": "journey_agency_new_business", "fromStage": "contacted", "toStage": "qualified", "eligibilityRule": {}, "fromEventFields": [], "toEventFields": [], "allowedLag": {"amount": 14, "unit": "days"}, "maturityRule": {}, "dispositions": ["qualified", "disqualified", "unknown"], "reentryRule": "new_journey_instance", "outcomeRule": {}, "required": true, "nativeMapping": "UNKNOWN" },
    { "edgeId": "qualified_to_strategy_call", "journeyId": "agency_new_business", "journeyInstanceId": "journey_agency_new_business", "fromStage": "qualified", "toStage": "strategy_call", "eligibilityRule": {}, "fromEventFields": [], "toEventFields": [], "allowedLag": {"amount": 30, "unit": "days"}, "maturityRule": {}, "dispositions": ["booked", "not_booked", "unknown"], "reentryRule": "new_journey_instance", "outcomeRule": {}, "required": true, "nativeMapping": "UNKNOWN" },
    { "edgeId": "strategy_call_to_showed", "journeyId": "agency_new_business", "journeyInstanceId": "journey_agency_new_business", "fromStage": "strategy_call", "toStage": "showed", "eligibilityRule": {}, "fromEventFields": [], "toEventFields": [], "allowedLag": {"amount": 14, "unit": "days"}, "maturityRule": {}, "dispositions": ["showed", "no_show", "cancelled", "unknown"], "reentryRule": "new_journey_instance", "outcomeRule": {}, "required": true, "nativeMapping": "MAPPED" },
    { "edgeId": "showed_to_decision_30d", "journeyId": "agency_new_business", "journeyInstanceId": "journey_agency_new_business", "fromStage": "showed", "toStage": "decision", "eligibilityRule": {}, "fromEventFields": [], "toEventFields": [], "allowedLag": {"amount": 30, "unit": "days"}, "maturityRule": {}, "dispositions": ["won", "lost", "open", "unknown"], "reentryRule": "same_journey_instance", "outcomeRule": {}, "required": true, "nativeMapping": "MAPPED", "reportingWindows": ["trailing60Days"] },
    { "edgeId": "showed_to_decision_60d", "journeyId": "agency_new_business", "journeyInstanceId": "journey_agency_new_business", "fromStage": "showed", "toStage": "decision", "eligibilityRule": {}, "fromEventFields": [], "toEventFields": [], "allowedLag": {"amount": 60, "unit": "days"}, "maturityRule": {}, "dispositions": ["won", "lost", "open", "unknown"], "reentryRule": "same_journey_instance", "outcomeRule": {}, "required": true, "nativeMapping": "MAPPED", "reportingWindows": ["trailing90Days"] },
    { "edgeId": "showed_to_decision", "journeyId": "agency_new_business", "journeyInstanceId": "journey_agency_new_business", "fromStage": "showed", "toStage": "decision", "eligibilityRule": {}, "fromEventFields": [], "toEventFields": [], "allowedLag": {"amount": 90, "unit": "days"}, "maturityRule": {}, "dispositions": ["won", "lost", "open", "unknown"], "reentryRule": "same_journey_instance", "outcomeRule": {}, "required": true, "nativeMapping": "MAPPED", "reportingWindows": ["trailing180Days"] },
    { "edgeId": "won_to_collected_revenue", "journeyId": "agency_new_business", "journeyInstanceId": "journey_agency_new_business", "fromStage": "won", "toStage": "collected_revenue", "eligibilityRule": {}, "fromEventFields": [], "toEventFields": [], "allowedLag": {"amount": 60, "unit": "days"}, "maturityRule": {}, "dispositions": ["collected", "uncollected", "unknown"], "reentryRule": "new_journey_instance", "outcomeRule": {}, "required": true, "nativeMapping": "MAPPED", "measure": "VALUE" },
    { "edgeId": "onboarding_ready_to_access", "journeyId": "client_onboarding", "journeyInstanceId": "journey_client_onboarding", "fromStage": "onboarding_ready", "toStage": "access_in_progress", "eligibilityRule": {}, "fromEventFields": [], "toEventFields": [], "allowedLag": {"amount": 14, "unit": "days"}, "maturityRule": {}, "dispositions": ["advanced", "stalled", "unknown"], "reentryRule": "same_journey_instance", "outcomeRule": {}, "required": true, "nativeMapping": "MAPPED" },
    { "edgeId": "access_to_submitted", "journeyId": "client_onboarding", "journeyInstanceId": "journey_client_onboarding", "fromStage": "access_in_progress", "toStage": "submitted_for_review", "eligibilityRule": {}, "fromEventFields": [], "toEventFields": [], "allowedLag": {"amount": 30, "unit": "days"}, "maturityRule": {}, "dispositions": ["advanced", "stalled", "unknown"], "reentryRule": "same_journey_instance", "outcomeRule": {}, "required": true, "nativeMapping": "MAPPED" },
    { "edgeId": "submitted_to_strategy_start", "journeyId": "client_onboarding", "journeyInstanceId": "journey_client_onboarding", "fromStage": "submitted_for_review", "toStage": "strategy_in_progress", "eligibilityRule": {}, "fromEventFields": [], "toEventFields": [], "allowedLag": {"amount": 14, "unit": "days"}, "maturityRule": {}, "dispositions": ["advanced", "stalled", "unknown"], "reentryRule": "same_journey_instance", "outcomeRule": {}, "required": true, "nativeMapping": "MAPPED" },
    { "edgeId": "strategy_start_to_strategy_sent", "journeyId": "client_onboarding", "journeyInstanceId": "journey_client_onboarding", "fromStage": "strategy_in_progress", "toStage": "strategy_sent", "eligibilityRule": {}, "fromEventFields": [], "toEventFields": [], "allowedLag": {"amount": 14, "unit": "days"}, "maturityRule": {}, "dispositions": ["advanced", "stalled", "unknown"], "reentryRule": "same_journey_instance", "outcomeRule": {}, "required": true, "nativeMapping": "MAPPED" },
    { "edgeId": "strategy_sent_to_creative_start", "journeyId": "client_onboarding", "journeyInstanceId": "journey_client_onboarding", "fromStage": "strategy_sent", "toStage": "creative_in_progress", "eligibilityRule": {}, "fromEventFields": [], "toEventFields": [], "allowedLag": {"amount": 14, "unit": "days"}, "maturityRule": {}, "dispositions": ["advanced", "stalled", "unknown"], "reentryRule": "same_journey_instance", "outcomeRule": {}, "required": true, "nativeMapping": "MAPPED" },
    { "edgeId": "creative_start_to_creative_sent", "journeyId": "client_onboarding", "journeyInstanceId": "journey_client_onboarding", "fromStage": "creative_in_progress", "toStage": "creative_sent", "eligibilityRule": {}, "fromEventFields": [], "toEventFields": [], "allowedLag": {"amount": 14, "unit": "days"}, "maturityRule": {}, "dispositions": ["advanced", "stalled", "unknown"], "reentryRule": "same_journey_instance", "outcomeRule": {}, "required": true, "nativeMapping": "MAPPED" },
    { "edgeId": "creative_sent_to_build", "journeyId": "client_onboarding", "journeyInstanceId": "journey_client_onboarding", "fromStage": "creative_sent", "toStage": "build_in_progress", "eligibilityRule": {}, "fromEventFields": [], "toEventFields": [], "allowedLag": {"amount": 14, "unit": "days"}, "maturityRule": {}, "dispositions": ["advanced", "stalled", "unknown"], "reentryRule": "same_journey_instance", "outcomeRule": {}, "required": true, "nativeMapping": "MAPPED" },
    { "edgeId": "build_to_live", "journeyId": "client_onboarding", "journeyInstanceId": "journey_client_onboarding", "fromStage": "build_in_progress", "toStage": "live", "eligibilityRule": {}, "fromEventFields": [], "toEventFields": [], "allowedLag": {"amount": 30, "unit": "days"}, "maturityRule": {}, "dispositions": ["advanced", "stalled", "unknown"], "reentryRule": "same_journey_instance", "outcomeRule": {}, "required": true, "nativeMapping": "MAPPED" }
  ]
}
