{
  "profileId": "grom_internal",
  "version": "1.0.0",
  "coverageFloor": 0.8,
  "edges": [
    { "edgeId": "enquiry_to_contacted", "journeyId": "agency_new_business", "journeyInstanceId": "journey_agency_new_business", "fromStage": "enquiry", "toStage": "contacted", "eligibilityRule": {}, "fromEventFields": [], "toEventFields": [], "allowedLag": { "amount": 2, "unit": "days" }, "maturityRule": {}, "dispositions": ["contacted", "unresponsive", "unknown"], "reentryRule": "new_journey_instance", "outcomeRule": {}, "required": true, "nativeMapping": "MAPPED" },
    { "edgeId": "contacted_to_qualified", "journeyId": "agency_new_business", "journeyInstanceId": "journey_agency_new_business", "fromStage": "contacted", "toStage": "qualified", "eligibilityRule": {}, "fromEventFields": [], "toEventFields": [], "allowedLag": { "amount": 14, "unit": "days" }, "maturityRule": {}, "dispositions": ["qualified", "disqualified", "unknown"], "reentryRule": "new_journey_instance", "outcomeRule": {}, "required": true, "nativeMapping": "UNKNOWN" },
    { "edgeId": "qualified_to_strategy_call", "journeyId": "agency_new_business", "journeyInstanceId": "journey_agency_new_business", "fromStage": "qualified", "toStage": "strategy_call", "eligibilityRule": {}, "fromEventFields": [], "toEventFields": [], "allowedLag": { "amount": 30, "unit": "days" }, "maturityRule": {}, "dispositions": ["booked", "not_booked", "unknown"], "reentryRule": "new_journey_instance", "outcomeRule": {}, "required": true, "nativeMapping": "UNKNOWN" },
    { "edgeId": "strategy_call_to_showed", "journeyId": "agency_new_business", "journeyInstanceId": "journey_agency_new_business", "fromStage": "strategy_call", "toStage": "showed", "eligibilityRule": {}, "fromEventFields": [], "toEventFields": [], "allowedLag": { "amount": 14, "unit": "days" }, "maturityRule": {}, "dispositions": ["showed", "no_show", "cancelled", "unknown"], "reentryRule": "new_journey_instance", "outcomeRule": {}, "required": true, "nativeMapping": "MAPPED" },
    { "edgeId": "showed_to_decision_30d", "journeyId": "agency_new_business", "journeyInstanceId": "journey_agency_new_business", "fromStage": "showed", "toStage": "decision", "eligibilityRule": {}, "fromEventFields": [], "toEventFields": [], "allowedLag": { "amount": 30, "unit": "days" }, "maturityRule": {}, "dispositions": ["won", "lost", "open", "unknown"], "reentryRule": "same_journey_instance", "outcomeRule": {}, "required": true, "nativeMapping": "MAPPED", "reportingWindows": ["trailing60Days"] },
    { "edgeId": "showed_to_decision_60d", "journeyId": "agency_new_business", "journeyInstanceId": "journey_agency_new_business", "fromStage": "showed", "toStage": "decision", "eligibilityRule": {}, "fromEventFields": [], "toEventFields": [], "allowedLag": { "amount": 60, "unit": "days" }, "maturityRule": {}, "dispositions": ["won", "lost", "open", "unknown"], "reentryRule": "same_journey_instance", "outcomeRule": {}, "required": true, "nativeMapping": "MAPPED", "reportingWindows": ["trailing90Days"] },
    { "edgeId": "showed_to_decision", "journeyId": "agency_new_business", "journeyInstanceId": "journey_agency_new_business", "fromStage": "showed", "toStage": "decision", "eligibilityRule": {}, "fromEventFields": [], "toEventFields": [], "allowedLag": { "amount": 90, "unit": "days" }, "maturityRule": {}, "dispositions": ["won", "lost", "open", "unknown"], "reentryRule": "same_journey_instance", "outcomeRule": {}, "required": true, "nativeMapping": "MAPPED", "reportingWindows": ["trailing180Days"] },
    { "edgeId": "won_to_collected_revenue", "journeyId": "agency_new_business", "journeyInstanceId": "journey_agency_new_business", "fromStage": "won", "toStage": "collected_revenue", "eligibilityRule": {}, "fromEventFields": [], "toEventFields": [], "allowedLag": { "amount": 60, "unit": "days" }, "maturityRule": {}, "dispositions": ["collected", "uncollected", "unknown"], "reentryRule": "new_journey_instance", "outcomeRule": {}, "required": true, "nativeMapping": "MAPPED", "measure": "VALUE" },
    { "edgeId": "won_to_internal_handoff", "journeyId": "client_onboarding", "journeyInstanceId": "journey_client_onboarding", "fromStage": "won_or_paid", "toStage": "internal_handoff", "eligibilityRule": {}, "fromEventFields": [], "toEventFields": [], "allowedLag": { "amount": 7, "unit": "days" }, "maturityRule": {}, "dispositions": ["handed_off", "not_handed_off", "unknown"], "reentryRule": "new_journey_instance", "outcomeRule": {}, "required": true, "nativeMapping": "UNKNOWN" },
    { "edgeId": "handoff_to_activation", "journeyId": "client_onboarding", "journeyInstanceId": "journey_client_onboarding", "fromStage": "internal_handoff", "toStage": "portal_or_project_activation", "eligibilityRule": {}, "fromEventFields": [], "toEventFields": [], "allowedLag": { "amount": 7, "unit": "days" }, "maturityRule": {}, "dispositions": ["activated", "not_activated", "unknown"], "reentryRule": "same_journey_instance", "outcomeRule": {}, "required": true, "nativeMapping": "UNKNOWN" },
    { "edgeId": "activation_to_assets_requested", "journeyId": "client_onboarding", "journeyInstanceId": "journey_client_onboarding", "fromStage": "portal_or_project_activation", "toStage": "assets_requested", "eligibilityRule": {}, "fromEventFields": [], "toEventFields": [], "allowedLag": { "amount": 7, "unit": "days" }, "maturityRule": {}, "dispositions": ["requested", "not_requested", "unknown"], "reentryRule": "same_journey_instance", "outcomeRule": {}, "required": true, "nativeMapping": "UNKNOWN" },
    { "edgeId": "assets_requested_to_assets_complete", "journeyId": "client_onboarding", "journeyInstanceId": "journey_client_onboarding", "fromStage": "assets_requested", "toStage": "assets_complete", "eligibilityRule": {}, "fromEventFields": [], "toEventFields": [], "allowedLag": { "amount": 30, "unit": "days" }, "maturityRule": {}, "dispositions": ["complete", "incomplete", "unknown"], "reentryRule": "same_journey_instance", "outcomeRule": {}, "required": true, "nativeMapping": "UNKNOWN" },
    { "edgeId": "assets_complete_to_strategy_approved", "journeyId": "client_onboarding", "journeyInstanceId": "journey_client_onboarding", "fromStage": "assets_complete", "toStage": "strategy_or_design_approved", "eligibilityRule": {}, "fromEventFields": [], "toEventFields": [], "allowedLag": { "amount": 30, "unit": "days" }, "maturityRule": {}, "dispositions": ["approved", "not_approved", "unknown"], "reentryRule": "same_journey_instance", "outcomeRule": {}, "required": true, "nativeMapping": "UNKNOWN" },
    { "edgeId": "strategy_approved_to_build", "journeyId": "client_onboarding", "journeyInstanceId": "journey_client_onboarding", "fromStage": "strategy_or_design_approved", "toStage": "build", "eligibilityRule": {}, "fromEventFields": [], "toEventFields": [], "allowedLag": { "amount": 30, "unit": "days" }, "maturityRule": {}, "dispositions": ["built", "not_built", "unknown"], "reentryRule": "same_journey_instance", "outcomeRule": {}, "required": true, "nativeMapping": "UNKNOWN" },
    { "edgeId": "build_to_qa", "journeyId": "client_onboarding", "journeyInstanceId": "journey_client_onboarding", "fromStage": "build", "toStage": "qa", "eligibilityRule": {}, "fromEventFields": [], "toEventFields": [], "allowedLag": { "amount": 14, "unit": "days" }, "maturityRule": {}, "dispositions": ["passed", "failed", "unknown"], "reentryRule": "same_journey_instance", "outcomeRule": {}, "required": true, "nativeMapping": "UNKNOWN" },
    { "edgeId": "qa_to_client_approval", "journeyId": "client_onboarding", "journeyInstanceId": "journey_client_onboarding", "fromStage": "qa", "toStage": "client_approval", "eligibilityRule": {}, "fromEventFields": [], "toEventFields": [], "allowedLag": { "amount": 14, "unit": "days" }, "maturityRule": {}, "dispositions": ["approved", "not_approved", "unknown"], "reentryRule": "same_journey_instance", "outcomeRule": {}, "required": true, "nativeMapping": "UNKNOWN" },
    { "edgeId": "client_approval_to_launch", "journeyId": "client_onboarding", "journeyInstanceId": "journey_client_onboarding", "fromStage": "client_approval", "toStage": "launch", "eligibilityRule": {}, "fromEventFields": [], "toEventFields": [], "allowedLag": { "amount": 14, "unit": "days" }, "maturityRule": {}, "dispositions": ["launched", "not_launched", "unknown"], "reentryRule": "same_journey_instance", "outcomeRule": {}, "required": true, "nativeMapping": "UNKNOWN" },
    { "edgeId": "launch_to_first_value", "journeyId": "client_onboarding", "journeyInstanceId": "journey_client_onboarding", "fromStage": "launch", "toStage": "first_value", "eligibilityRule": {}, "fromEventFields": [], "toEventFields": [], "allowedLag": { "amount": 30, "unit": "days" }, "maturityRule": {}, "dispositions": ["first_value", "not_yet", "unknown"], "reentryRule": "same_journey_instance", "outcomeRule": {}, "required": true, "nativeMapping": "UNKNOWN" }
  ]
}
